rectype,issueid,project_owner,project_name,actor,time,text,action,title,clean_text
rectype,issueid,project_owner,project_name,actor,time,text,action,title,text
issue_title,116,idan,oauthlib,techtonik,2013-02-17 19:06:59,"https://plus.google.com/110592708597698994191/posts/UGAzZ9QBSq5

OAuth and OAuth2 are hard to compare, provide different workflow and requirements for the source and target systems. Making implementation for them separated helps to keep single responsibility principle for the sake of simplicity.
",start issue,Separate OAuth from OAuth2 into separate libraries,oauth oauth2 hard compar provid differ workflow requir sourc target system make implement separ help keep singl respons principl sake simplic
issue_closed,116,idan,oauthlib,ib-lundgren,2013-02-20 22:46:29,,closed issue,Separate OAuth from OAuth2 into separate libraries,
issue_comment,116,idan,oauthlib,warsaw,2013-02-18 17:16:18,"The implementation actually shares some common code, so it seems pointless to me to separate them artificially, but then I'm not the author.
",,,the implement actual share common code seem pointless separ artifici Im author
issue_comment,116,idan,oauthlib,ib-lundgren,2013-02-18 18:03:32,"From the users perspective I doubt two libraries will be any better than one in this case. What a user would benefit from is clear and exhaustive documentation with many examples. An area where we admittedly are lacking greatly at the moment but certainly is high priority. Solid documentation could easily rid any confusion of when to use OAuth 1 or 2. 

Regarding when to use OAuth 1 or 2 I've opened issue #118 .
Clarifying that oauthlib separates 1 and 2 is now issue #117 .
One thing I've been meaning to add is a F.A.Q. for clients and providers to address common issues quickly. I've opened issue #119  tracking this.

The reason the documentation is lacking is twofold. Firstly I avoid writing documentation before I feel the interface has matured enough to be usable by users uninterested in digging into internals themselves. Until then the unittests and code serve as documentation. Secondly, I currently can't spend nearly as much time as I'd like on OAuthLib.
",,,from user perspect I doubt two librari better one case what user would benefit clear exhaust document mani exampl An area admittedli lack greatli moment certainli high prioriti solid document could easili rid confus use oauth 1 2 regard use oauth 1 2 ive open issu 118 clarifi oauthlib separ 1 2 issu 117 one thing ive mean add faq client provid address common issu quickli ive open issu 119 track the reason document lack twofold firstli I avoid write document I feel interfac matur enough usabl user uninterest dig intern until unittest code serv document secondli I current cant spend nearli much time Id like oauthlib
issue_comment,116,idan,oauthlib,techtonik,2013-02-21 08:27:38,"Exhaustive documentation is exhausting. It is indeed a problem to make a proper tutorial about OAuth itself, which also needs a tutorial about how digital signatures work and what are they protecting from.
",,,exhaust document exhaust It inde problem make proper tutori oauth also need tutori digit signatur work protect
issue_comment,116,idan,oauthlib,ib-lundgren,2013-02-21 10:49:08,"Exhaustive might not be the right word for it. What I hope to eventually
have is a wide span of different documentation, from quick tips to
tutorials to in depth analysis. OAuth, especially 2, is notoriously hard to
get right and I think there is much that can be done to help users, be it
in code or docs.

On Thu, Feb 21, 2013 at 9:27 AM, anatoly techtonik <notifications@github.com

> wrote:
> 
> Exhaustive documentation is exhausting. It is indeed a problem to make a
> proper tutorial about OAuth itself, which also needs a tutorial about how
> digital signatures work and what are they protecting from.
> 
> —
> Reply to this email directly or view it on GitHubhttps://github.com/idan/oauthlib/issues/116#issuecomment-13878069.
",,,exhaust might right word what I hope eventu wide span differ document quick tip tutori depth analysi oauth especi 2 notori hard get right I think much done help user code doc On thu feb 21 2013 927 AM anatoli techtonik notificationsgithubcom
