rectype,issueid,project_owner,project_name,actor,time,text,action,title,clean_text
pull_request_commit_comment,1028,nilearn,nilearn,GaelVaroquaux,2016-02-29 20:00:53,"> Actually, the mask's affine transform is just an identity matrix.

So it's wrong. We must fix it.

@AlexandreAbraham, any chance that you can grab the affine from the
background image and upload to nitrc a fixed version of the mask?
",463dc2ab4d17fd7456b7677a1638237be075bc0e,"(None, '', u'examples/02_decoding/plot_miyawaki_encoding.py')",So wrong We must fix alexandreabraham chanc grab affin background imag upload nitrc fix version mask
pull_request_commit_comment,1028,nilearn,nilearn,AlexandreAbraham,2016-03-02 09:24:02,"On it.
",463dc2ab4d17fd7456b7677a1638237be075bc0e,"(None, '', u'examples/02_decoding/plot_miyawaki_encoding.py')",On
pull_request_commit_comment,1028,nilearn,nilearn,AlexandreAbraham,2016-03-02 09:57:58,"Done in PR #1038. Note that, unfortunately, you will have to erase manually your miyawaki2008 folder to force downloading.
",463dc2ab4d17fd7456b7677a1638237be075bc0e,"(None, '', u'examples/02_decoding/plot_miyawaki_encoding.py')",done PR 1038 note unfortun eras manual miyawaki2008 folder forc download
pull_request_commit_comment,1028,nilearn,nilearn,mjboos,2016-03-02 17:33:34,"Great, thank you!
",463dc2ab4d17fd7456b7677a1638237be075bc0e,"(None, '', u'examples/02_decoding/plot_miyawaki_encoding.py')",great thank
pull_request_commit,1028,nilearn,nilearn,mjboos,2016-02-27 12:05:07,"Encoding example using the Miyawaki et al., 2008 dataset",4df8a7f8070e08c81d381da66496910ca4627645,,encod exampl use miyawaki et al 2008 dataset
pull_request_commit,1028,nilearn,nilearn,mjboos,2016-02-27 12:09:48,Encoding example for Miyawaki dataset,2fb9da183a1eb58a8f49cae70e89df420fe60a78,,encod exampl miyawaki dataset
pull_request_commit,1028,nilearn,nilearn,mjboos,2016-02-27 22:05:24,"Added plots of the stimuli, changed description and fixed pep8 violations",59442085239832e1e622d1ff390746666391c572,,ad plot stimuli chang descript fix pep8 violat
pull_request_commit,1028,nilearn,nilearn,mjboos,2016-02-27 22:30:52,deleted symmetric cbar,d23cc93caf86845069055102a4080974ebc15fe5,,delet symmetr cbar
pull_request_commit,1028,nilearn,nilearn,mjboos,2016-02-28 00:08:45,rephrased description and comments,a383ede0b04d941b1b119be6c8e96dfa449da475,,rephras descript comment
pull_request_commit,1028,nilearn,nilearn,mjboos,2016-02-28 17:57:25,integrated comments,f9235a5b68b324eb93bfceefc68ab01529706c4e,,integr comment
pull_request_commit,1028,nilearn,nilearn,mjboos,2016-02-29 15:42:24,"Slight rephrasing, added marker_color argument",07a4c40ad2d9500d10d0392896ef026eb453fc37,,slight rephras ad markercolor argument
pull_request_commit,1028,nilearn,nilearn,mjboos,2016-02-29 16:32:39,changed variable names,3440fbfd920ca88492f35086820dcd6913bf36a7,,chang variabl name
pull_request_commit,1028,nilearn,nilearn,mjboos,2016-03-02 18:39:45,using affine transform of mask,463dc2ab4d17fd7456b7677a1638237be075bc0e,,use affin transform mask
