rectype,issueid,project_owner,project_name,actor,time,text,action,title,clean_text
rectype,issueid,project_owner,project_name,actor,time,text,action,title,text
issue_title,186,nilearn,nilearn,VirgileFritsch,2014-04-11 16:00:27,"Added a downloader + an example for the Oasis dataset that we processed with Elvis. We put the archive containing the data on NITRC.

DARTEL version will come later.

I had hard time setting up the downloader: sometimes, it downloaded the same archive twice (I do not know why). Everything seems to be ok now but it would be cool if someone can double-check.
Thank you.
",start issue,VBM on Oasis cross-sectional dataset (> 400 subjects),ad download exampl oasi dataset process elvi We put archiv contain data nitrc dartel version come later I hard time set download sometim download archiv twice I know everyth seem ok would cool someon doublecheck thank
issue_closed,186,nilearn,nilearn,GaelVaroquaux,2014-04-26 12:55:46,,closed issue,VBM on Oasis cross-sectional dataset (> 400 subjects),
pull_request_title,186,nilearn,nilearn,VirgileFritsch,2014-04-11 16:00:27,"Added a downloader + an example for the Oasis dataset that we processed with Elvis. We put the archive containing the data on NITRC.

DARTEL version will come later.

I had hard time setting up the downloader: sometimes, it downloaded the same archive twice (I do not know why). Everything seems to be ok now but it would be cool if someone can double-check.
Thank you.
",28f312fde883e1b43ca4ece006cd770948ad0407,VBM on Oasis cross-sectional dataset (> 400 subjects),ad download exampl oasi dataset process elvi We put archiv contain data nitrc dartel version come later I hard time set download sometim download archiv twice I know everyth seem ok would cool someon doublecheck thank
pull_request_merged,186,nilearn,nilearn,GaelVaroquaux,2014-04-26 12:55:46,VBM on Oasis cross-sectional dataset (> 400 subjects),5a769837e42352b7a7c6c0797a10aeed9937966e,Pull request merge from VirgileFritsch/nilearn:oasis_vbm to nilearn/nilearn:master,vbm oasi crosssect dataset
issue_comment,186,nilearn,nilearn,agramfort,2014-04-11 16:06:51,"I am curious can you share an image?
",,,I curiou share imag
issue_comment,186,nilearn,nilearn,agramfort,2014-04-21 13:31:49,"really nice !
",,,realli nice
issue_comment,186,nilearn,nilearn,GaelVaroquaux,2014-04-11 16:14:47,"> @dohmatob @AlexandreAbraham @GaelVaroquaux @bthirion This is what came
> out from our Parietal retreat project.

I don't have time to look in details, but it seems that it's a blasting
success. Bravo to you and @dohmatob.
",,,I dont time look detail seem blast success bravo dohmatob
issue_comment,186,nilearn,nilearn,GaelVaroquaux,2014-04-11 16:16:41,"You closed by mistake, @dohmatob  :)
",,,you close mistak dohmatob
issue_comment,186,nilearn,nilearn,GaelVaroquaux,2014-04-21 13:22:41,"@agramfort : here is the image that the current example generates:

![plot_oasis_vbm_1](https://cloud.githubusercontent.com/assets/208217/2754578/fd9d95c8-c957-11e3-8262-d489e0005130.png)

It's splendid! Great job @VirgileFritsch  and @dohmatob 
",,,agramfort imag current exampl gener plotoasisvbm1 it splendid great job virgilefritsch dohmatob
issue_comment,186,nilearn,nilearn,GaelVaroquaux,2014-04-24 13:00:06,"That's cool. Thanks @VirgileFritsch.

What kind of prediction scores are you getting?

I am puzzled that the non-zero voxels are different from in the map that were obtained by mass-univariate approach. The voxel selection here is relying on an ANOVA. I agree that it is not permuted, but that should only be a problem of setting the threshold. I am surprised that in the image above I see scattered voxels that I wasn't seeing in the mass univariate analysis.
",,,that cool thank virgilefritsch what kind predict score get I puzzl nonzero voxel differ map obtain massunivari approach the voxel select reli anova I agre permut problem set threshold I surpris imag I see scatter voxel I wasnt see mass univari analysi
issue_comment,186,nilearn,nilearn,GaelVaroquaux,2014-04-24 13:18:36,"OK, that's interesting.

Out of curiosity: what happens if you smooth for selection of voxels (to apply the ANOVA) and not from the SVM? What is the corresponding prediction score?

Also, what do the maps and the accuracy look like if you make a compromise and smooth a little less (say by 3mm) and take a bit more voxels?
",,,OK that interest out curios happen smooth select voxel appli anova svm what correspond predict score also map accuraci look like make compromis smooth littl less say 3mm take bit voxel
issue_comment,186,nilearn,nilearn,GaelVaroquaux,2014-04-24 13:41:28,"Yeah, I realize that smoothing for selection and not SVM is tricky. Let's skip that for now.

What's the prediction score that you are getting with the map right above?
",,,yeah I realiz smooth select svm tricki let skip what predict score get map right
issue_comment,186,nilearn,nilearn,GaelVaroquaux,2014-04-24 14:58:22,"I find that they look better (more consistent with expected neuroanatomical behavior). Do you mind updating the unsmoothed one (the original that you had, at 70% prediction score).
",,,I find look better consist expect neuroanatom behavior Do mind updat unsmooth one origin 70 predict score
issue_comment,186,nilearn,nilearn,GaelVaroquaux,2014-04-24 17:05:12,"Splendide!
",,,splendid
issue_comment,186,nilearn,nilearn,GaelVaroquaux,2014-04-26 11:14:51,"I think that the remaining things to be done are:
- Not embedded completely the CSV file in the tests
- Add a detailed docstring in the examples

I might do the latter right now and merge. @VirgileFritsch, you can refactor the test after. The reason is that I am sending invitations for the nilearn sprint, and I think that this example will help a lot to make good advertising for nilearn.
",,,I think remain thing done not embed complet csv file test add detail docstr exampl I might latter right merg virgilefritsch refactor test the reason I send invit nilearn sprint I think exampl help lot make good advertis nilearn
issue_comment,186,nilearn,nilearn,GaelVaroquaux,2014-04-26 12:52:12,"So, I am finishing off part of this PR and merging it.

I noticed a pretty bad mistake: you were using f_classif for feature selection with a regression task. I fixed the problem and scores are better and maps look cleaner. Maybe this explains part of the weird behavior that we were observing, in particular my remark about the voxels selected not being the same.
",,,So I finish part PR merg I notic pretti bad mistak use fclassif featur select regress task I fix problem score better map look cleaner mayb explain part weird behavior observ particular remark voxel select
issue_comment,186,nilearn,nilearn,GaelVaroquaux,2014-04-26 12:56:30,"I have merged this PR, but I'd like the finishing touch to the testing to be put.
",,,I merg PR Id like finish touch test put
issue_comment,186,nilearn,nilearn,GaelVaroquaux,2014-04-26 14:02:33,"> I can take on the missing improvement about docstrings. Do you wish me
> to open a new PR?

If you want to further improve the docstring, I think that this can be 
done without a new PR.

> Regarding the CSV loading, we agreed with @AlexandreAbraham that it was a more
> general issue. Besides, the tests fail anyway on my box, but they pass on
> Travis. I really do not understand that yet. Install problems?

It does pass on my box.

For this part, I think that a new PR would be better, given that it would
be good to go back and forth with @AlexandreAbraham on this.
",,,If want improv docstr I think done without new PR It pass box for part I think new PR would better given would good go back forth alexandreabraham
issue_comment,186,nilearn,nilearn,VirgileFritsch,2014-04-11 16:01:15,"@dohmatob @AlexandreAbraham @GaelVaroquaux @bthirion This is what came out from our Parietal retreat project.
",,,dohmatob alexandreabraham gaelvaroquaux bthirion thi came pariet retreat project
issue_comment,186,nilearn,nilearn,AlexandreAbraham,2014-04-11 16:07:01,"@VirgileFritsch, would a verbose option have been useful for you? I did not do it because I was the only one touching to this code but this can be done easily.
",,,virgilefritsch would verbos option use I I one touch code done easili
issue_comment,186,nilearn,nilearn,dohmatob,2014-04-11 16:16:07,"@VirgileFritsch: Lemme run DARTEL on the 12 discs right away.
",,,virgilefritsch lemm run dartel 12 disc right away
issue_comment,186,nilearn,nilearn,dohmatob,2014-04-11 16:17:30,"Yep, and your reaction time was something less than 4 seconds. Impressive! Thanks
",,,yep reaction time someth less 4 second impress thank
issue_comment,186,nilearn,nilearn,AlexandreAbraham,2014-04-11 16:18:03,"Could you also keep the non-dartel data? I would be interested to see the differences induced by the preprocessing.
",,,could also keep nondartel data I would interest see differ induc preprocess
issue_comment,186,nilearn,nilearn,VirgileFritsch,2014-04-11 19:49:43,"@agramfort Images on the retreat wiki ;-)
(Only différence is thé number of subjects)
",,,agramfort imag retreat wiki onli différenc thé number subject
issue_comment,186,nilearn,nilearn,VirgileFritsch,2014-04-11 20:23:41,"@AlexandreAbraham Maybe the verbose option would have been useful, I do not know actually.
I do not think you need to worry about the verbose option. There are much important things to do I guess.
",,,alexandreabraham mayb verbos option would use I know actual I think need worri verbos option there much import thing I guess
issue_comment,186,nilearn,nilearn,bthirion,2014-04-13 17:28:20,"Minor fixes, then  I'm OK for merge.
",,,minor fix Im OK merg
issue_comment,186,nilearn,nilearn,VirgileFritsch,2014-04-14 12:42:12,"Comments addressed, need one more +1 to be able to merge ;)
Or maybe you want to wait for DARTEL-preprocessed data being available...
",,,comment address need one 1 abl merg Or mayb want wait dartelpreprocess data avail
issue_comment,186,nilearn,nilearn,VirgileFritsch,2014-04-15 18:15:03,"Please do not merge yet as I found a bug in the archive: the subject list in the CSV does not match the subjects that the archive actually contains.
I will add a `.subject_ids` attribute to the dataset Bunch object so that matching the image files wih the CSV content becomes easier.
",,,pleas merg yet I found bug archiv subject list csv match subject archiv actual contain I add attribut dataset bunch object match imag file wih csv content becom easier
issue_comment,186,nilearn,nilearn,AlexandreAbraham,2014-04-15 18:19:11,"I usually load the CSV and resize its content depending on `n_subjects` for example. It is light, feel free to load it and modify the content if it's easier.
",,,I usual load csv resiz content depend exampl It light feel free load modifi content easier
issue_comment,186,nilearn,nilearn,VirgileFritsch,2014-04-16 14:33:43,"I corrected the bug and added DARTEL-normalized data in the datasets.

@AlexandreAbraham I am in trouble with testing the downloader: it needs the .csv file to be actually downloaded. I saw that your ADHD downloader has the same requirement but I could not reproduce the correct settings in my own tests. Could you help me debugging this? Thanks!
",,,I correct bug ad dartelnorm data dataset alexandreabraham I troubl test download need csv file actual download I saw adhd download requir I could reproduc correct set test could help debug thank
issue_comment,186,nilearn,nilearn,VirgileFritsch,2014-04-23 09:55:00,"> @AlexandreAbraham I am in trouble with testing the downloader: it needs the .csv file to be actually downloaded. I saw that your ADHD downloader has the same requirement but I could not reproduce the correct settings in my own tests. Could you help me debugging this? Thanks!

ping @AlexandreAbraham ? :)
",,,ping alexandreabraham
issue_comment,186,nilearn,nilearn,AlexandreAbraham,2014-04-23 12:54:42,"Well, you already said it. A fake ADHD tarball is provided in nilearn for ADHD test to run. If it is not permitted, then we should in fact generate a fake file. But if we do that, it will end up to copy a part of the csv file in the test file. I don't know which is the best solution.
",,,well alreadi said A fake adhd tarbal provid nilearn adhd test run If permit fact gener fake file but end copi part csv file test file I dont know best solut
issue_comment,186,nilearn,nilearn,VirgileFritsch,2014-04-23 13:22:16,"I think we are not talking about the same issue there. We assume that it is OK to embed a copy of the CSV file (*). I did it.
But even with the CSV file copied in the `nilearn_data/data` directory, the test is not passing and I do not understand why. I was asking if you could help me debugging the test failure ;)

(*) this assumption may be wrong regarding Gael's comment https://github.com/nilearn/nilearn/pull/186#discussion_r11807486.
",,,I think talk issu We assum OK emb copi csv file I but even csv file copi directori test pass I understand I ask could help debug test failur assumpt may wrong regard gael comment
issue_comment,186,nilearn,nilearn,AlexandreAbraham,2014-04-23 17:41:52,"@VirgileFritsch: Thanks for your patience ;). You have undercover a huge bug in the dataset testing framework, thanks for that. It is now fixed. If you address my comments above and rebase your PR on master, then your tests should pass.
",,,virgilefritsch thank patienc you undercov huge bug dataset test framework thank It fix If address comment rebas PR master test pass
issue_comment,186,nilearn,nilearn,VirgileFritsch,2014-04-24 08:42:22,"> You have undercover a huge bug in the dataset testing framework

Come on, you are not that huge :-P

More seriously, good job and thanks for the help!
I will address your comments soon and then post a message here to notify everyone.
",,,come huge P more serious good job thank help I address comment soon post messag notifi everyon
issue_comment,186,nilearn,nilearn,VirgileFritsch,2014-04-24 12:28:44,"I changed permuted OLS for ANOVA + SVR.

I guess this might partly be a matter of parameters tuning and/or vizualisation, but:
- I do not find it as beautiful as the previous plot
- The prediction accuracy is low
- This is a much more heavy code (more than 20 lines for ANOVA + SVR. 3 lines for permuted OLS)

Way less striking as an example!
",,,I chang permut ol anova svr I guess might partli matter paramet tune andor vizualis I find beauti previou plot the predict accuraci low thi much heavi code 20 line anova svr 3 line permut ol way less strike exampl
issue_comment,186,nilearn,nilearn,VirgileFritsch,2014-04-24 12:36:05,"@AlexandreAbraham : More testing problems. As I mentionned, `len(mock.urls) == 2` (at line 344) when I run the tests on my laptop. Indeed:

<pre>
>>> print mock.urls
set(['file:///home/virgile/nilearn/nilearn/tests/data/archive_dartel.tgz',
     'file:///home/virgile/nilearn/nilearn/tests/data/data_usage_agreement.txt'])
</pre>

This is wrong when the tests are run on Travis, where the length of `mock.urls` is 3. Do you have an explanation? (I have no spurious `.coverage` file locally).
Is it possible that the recarray corresponding to the csv file counts as 1 on Travis, but 0 on my install? I am sorry, but I do not know anything about mock objects.
",,,alexandreabraham more test problem As I mention line 344 I run test laptop inde presetfilehomevirgilenilearnnilearntestsdataarchivedarteltgz filehomevirgilenilearnnilearntestsdatadatausageagreementtxt pre thi wrong test run travi length 3 Do explan I spuriou file local Is possibl recarray correspond csv file count 1 travi 0 instal I sorri I know anyth mock object
issue_comment,186,nilearn,nilearn,VirgileFritsch,2014-04-24 12:45:58,"No more testing problems on Travis, but there is still a discrepancy between the tests results on my box and on Travis... weird.
",,,No test problem travi still discrep test result box travi weird
issue_comment,186,nilearn,nilearn,VirgileFritsch,2014-04-24 12:47:16,"Two discussions are going on there, so let me draw your attention on this post (https://github.com/nilearn/nilearn/pull/186#issuecomment-41273812), @GaelVaroquaux @bthirion @agramfort 
",,,two discuss go let draw attent post gaelvaroquaux bthirion agramfort
issue_comment,186,nilearn,nilearn,VirgileFritsch,2014-04-24 12:51:43,"An image corresponding to the example:

![plot_oasis_vbm_anova_svm](http://drive.google.com/uc?export=view&id=0B1PlLN9y48T0MEV6eFM1alZ6RlU)
",,,An imag correspond exampl plotoasisvbmanovasvm
issue_comment,186,nilearn,nilearn,VirgileFritsch,2014-04-24 13:05:51,"> What kind of prediction scores are you getting?

roughly 70%
",,,roughli 70
issue_comment,186,nilearn,nilearn,VirgileFritsch,2014-04-24 13:08:09,"Smoothing at 5 voxels FWHM...

![plot_oasis_vbm_anova_svm_smoothed_fwhm5](http://drive.google.com/uc?export=view&id=0B1PlLN9y48T0VDZTWUo2WHdXMkE)

(prediction score drops to 62%)
",,,smooth 5 voxel fwhm plotoasisvbmanovasvmsmoothedfwhm5 predict score drop 62
issue_comment,186,nilearn,nilearn,VirgileFritsch,2014-04-24 13:14:02,"I can ""have the spurious clusters disappear"" (oh god, what am I writing...) by selecting only 1000 features instead of 5000. Obviously, the prediction accuracy drops again.
On the other hand, I can improve that accuracy by decreasing the amount of smoothing and considering more features.

(I never wrote that post, I definitely do NOT want people do what I just (did not) wrote)
",,,I spuriou cluster disappear oh god I write select 1000 featur instead 5000 obvious predict accuraci drop On hand I improv accuraci decreas amount smooth consid featur I never wrote post I definit not want peopl I wrote
issue_comment,186,nilearn,nilearn,VirgileFritsch,2014-04-24 13:33:43,"Now smoothing at 3 voxels FWHM (funny how targeting a particular effect spatial spread changes the map oO)

![plot_oasis_vbm_anova_svm_smoothed_fwhm5](http://drive.google.com/uc?export=view&id=0B1PlLN9y48T0U0t4cmRxLVUwNXc)

Regarding smoothing the data only for the ANOVA and not the SVM, It is tricky to run `cross_val_score` on that pipeline because I cannot figure out how to define it with scikit-learn API.
",,,now smooth 3 voxel fwhm funni target particular effect spatial spread chang map oO plotoasisvbmanovasvmsmoothedfwhm5 regard smooth data anova svm It tricki run pipelin I cannot figur defin scikitlearn api
issue_comment,186,nilearn,nilearn,VirgileFritsch,2014-04-24 14:02:27,"> I realize that smoothing for selection and not SVM is tricky. Let's skip that for now.

I just implemented the pipeline manually and used the same mask on both kind of images (necessary thing technically). Smoothing at 5 voxels FHWM, 5,000 ANOVA-selected features, accuracy measured with 3-fold CV.
![plot_oasis_vbm_anova_svm_smoothed_fwhm5](http://drive.google.com/uc?export=view&id=0B1PlLN9y48T0NmJLNlRsR1hCTWs) prior smoothing (accuracy 0.620486)
![oasis_vbm_anova_svm2_smoothed_fwhm5](http://drive.google.com/uc?export=view&id=0B1PlLN9y48T0TlJ4MVhyM3o1aVE) partial ""Gael's"" smoothing (accuracy 0.657893)
- increased number of features (10,000) ==> drop of the accuracy by ~= 0.01 in both cases.
- decreasing smoothing amount (3 vox. FHWM) ==> increase of the accuracy by ~= 0.02 in both cases (_activity pattern changes_)
- 5000 voxels and no smoothing seems not to be far from the optimal setting regarding the accuracy.
",,,I implement pipelin manual use mask kind imag necessari thing technic smooth 5 voxel fhwm 5000 anovaselect featur accuraci measur 3fold CV plotoasisvbmanovasvmsmoothedfwhm5 prior smooth accuraci 0620486 oasisvbmanovasvm2smoothedfwhm5 partial gael smooth accuraci 0657893 increas number featur 10000 decreas smooth amount 3 vox fhwm 5000 voxel smooth seem far optim set regard accuraci
issue_comment,186,nilearn,nilearn,VirgileFritsch,2014-04-24 14:52:48,"Updated figures and removed corresponding comments for the sake of clarity.
",,,updat figur remov correspond comment sake clariti
issue_comment,186,nilearn,nilearn,VirgileFritsch,2014-04-24 15:08:18,"Here you are: https://github.com/nilearn/nilearn/pull/186#issuecomment-41275789
",,,here
issue_comment,186,nilearn,nilearn,VirgileFritsch,2014-04-24 17:02:49,"In its current state (FHWM=2, n_subjects=100), the example generates:
![plot_oasis_vbm_anova_svm_smoothed_fwhm2_1500features_100subjects](http://drive.google.com/uc?export=view&id=0B1PlLN9y48T0b19nRkJsMFI2bk0) accuracy: 71.3%
![plot_oasis_vbm_permuted_ols_smoothed_fwhm2_100subjects](http://drive.google.com/uc?export=view&id=0B1PlLN9y48T0UGhnRWUyYVBpZ1E)
",,,In current state fhwm2 nsubjects100 exampl gener plotoasisvbmanovasvmsmoothedfwhm21500features100subject accuraci 713 plotoasisvbmpermutedolssmoothedfwhm2100subject
issue_comment,186,nilearn,nilearn,VirgileFritsch,2014-04-26 13:36:35,"OK, nice work! I can take on the missing improvement about docstrings. Do you wish me to open a new PR?

Regarding the CSV loading, we agreed with @AlexandreAbraham that it was a more general issue. Besides, the tests fail anyway on my box, but they pass on Travis. I really do not understand that yet. Install problems?
",,,OK nice work I take miss improv docstr Do wish open new PR regard csv load agre alexandreabraham gener issu besid test fail anyway box pass travi I realli understand yet instal problem
issue_comment,186,nilearn,nilearn,AlexandreAbraham,2014-04-26 14:08:49,"Tests work for me. @VirgileFritsch, can you mail me the trace of the failing test?
",,,test work virgilefritsch mail trace fail test
pull_request_commit_comment,186,nilearn,nilearn,bthirion,2014-04-13 17:11:19,"maybe masked_pvals instead of  p_ma
",28f312fde883e1b43ca4ece006cd770948ad0407,"(None, '', u'plot_oasis_vbm.py')",mayb maskedpv instead pma
pull_request_commit_comment,186,nilearn,nilearn,bthirion,2014-04-13 17:27:46,"This is really nice. I believe that this is because I have an old matplotlib on my box, but the figure does render well.
using e.g. plt.subplots_adjust(0., .1, .75, .9) is much nicer... 
",28f312fde883e1b43ca4ece006cd770948ad0407,"(None, '', u'plot_oasis_vbm.py')",thi realli nice I believ I old matplotlib box figur render well use eg pltsubplotsadjust0 1 75 9 much nicer
pull_request_commit_comment,186,nilearn,nilearn,GaelVaroquaux,2014-04-21 13:02:16,"These paragraphs (all those before the ""Parameters"" section) should be moved to the ""Notes"" section of the docstring).
",28f312fde883e1b43ca4ece006cd770948ad0407,"(None, '', u'nilearn/datasets.py')",these paragraph paramet section move note section docstr
pull_request_commit_comment,186,nilearn,nilearn,GaelVaroquaux,2014-04-21 13:06:50,"Maybe if n_subjects > 403 you should  raise a warning here?
",28f312fde883e1b43ca4ece006cd770948ad0407,"(None, '', u'nilearn/datasets.py')",mayb nsubject
pull_request_commit_comment,186,nilearn,nilearn,GaelVaroquaux,2014-04-21 13:07:12,"Same thing here: raise a warning for n_subjects > 415?
",28f312fde883e1b43ca4ece006cd770948ad0407,"(None, '', u'nilearn/datasets.py')",same thing rais warn nsubject
pull_request_commit_comment,186,nilearn,nilearn,GaelVaroquaux,2014-04-21 13:10:21,"Do you need a full copy of the OASIS csv for the tests? That sounds wrong. How about generating a csv file with fake information in the tests?
",28f312fde883e1b43ca4ece006cd770948ad0407,"(1, '', u'nilearn/tests/data/oasis_cross-sectional.csv')",Do need full copi oasi csv test that sound wrong how gener csv file fake inform test
pull_request_commit_comment,186,nilearn,nilearn,GaelVaroquaux,2014-04-21 13:13:53,"The example needs a title (in restructured text formating) to be able to be displayed properly on the generated example page.
",28f312fde883e1b43ca4ece006cd770948ad0407,"(1, '', u'plot_oasis_vbm.py')",the exampl need titl restructur text format abl display properli gener exampl page
pull_request_commit_comment,186,nilearn,nilearn,GaelVaroquaux,2014-04-21 13:14:41,"I would advise that you do not put your email address, only you name, unless you want to receive questions from users in a few years :$/
",28f312fde883e1b43ca4ece006cd770948ad0407,"(9, '', u'plot_oasis_vbm.py')",I would advis put email address name unless want receiv question user year
pull_request_commit_comment,186,nilearn,nilearn,GaelVaroquaux,2014-04-21 13:19:05,"Given that the focus of nilearn is on predictive modelling, I would prefer the OASIS example to perform an SVM ANOVA, a bit like the plot_haxby_anova_svm.py example.
",28f312fde883e1b43ca4ece006cd770948ad0407,"(None, '', u'plot_oasis_vbm.py')",given focu nilearn predict model I would prefer oasi exampl perform svm anova bit like plothaxbyanovasvmpi exampl
pull_request_commit_comment,186,nilearn,nilearn,eickenberg,2014-04-22 16:44:21,"24 is both in `missing_subjects` and `removed_outliers`. You don't seem to be `np.unique`-ing the list, only sorting  it, so 24 will probably be double.
",28f312fde883e1b43ca4ece006cd770948ad0407,"(None, '', u'nilearn/datasets.py')",24 you dont seem ing list sort 24 probabl doubl
pull_request_commit_comment,186,nilearn,nilearn,eickenberg,2014-04-22 16:45:40,"(Not that it matters much, since removing something is an idempotent operation ;) unless it raises an error)
",28f312fde883e1b43ca4ece006cd770948ad0407,"(None, '', u'nilearn/datasets.py')",not matter much sinc remov someth idempot oper unless rais error
pull_request_commit_comment,186,nilearn,nilearn,eickenberg,2014-04-22 16:53:50,"Could you add `standardize=False` to the constructor of your `NiftiMasker`? This is the default value, but I'd rather see it explicitly, because otherwise, if by a mishap somebody uses the example and sets `standardize=True`, then `gm_maps_masked.var(0) == 1.` everywhere.
",28f312fde883e1b43ca4ece006cd770948ad0407,"(None, '', u'plot_oasis_vbm.py')",could add constructor thi default valu Id rather see explicitli otherwis mishap somebodi use exampl set everywher
