rectype,issueid,project_owner,project_name,actor,time,text,action,title,clean_text
rectype,issueid,project_owner,project_name,actor,time,text,action,title,text
issue_title,930,nilearn,nilearn,GaelVaroquaux,2016-01-07 09:17:38,"We should do the work of grabbing the labels of the atlases in the downloaders and expose them uniformely. It would make the life of the users easier.
",start issue,Have a uniform representation of labels for atlases,We work grab label atlas download expos uniform It would make life user easier
issue_closed,930,nilearn,nilearn,AlexandreAbraham,2016-02-25 21:16:29,,closed issue,Have a uniform representation of labels for atlases,
issue_comment,930,nilearn,nilearn,AlexandreAbraham,2016-01-07 09:22:54,"What do you mean?
",,,what mean
issue_comment,930,nilearn,nilearn,AlexandreAbraham,2016-01-12 12:04:22,"OK, you mean that labels are not loaded in MSDL. They are loaded in Harvard Oxford.
",,,OK mean label load msdl they load harvard oxford
issue_comment,930,nilearn,nilearn,GaelVaroquaux,2016-01-07 19:21:54,"Return in-memory labels, loaded from the CSV file. The code to load
labels in Harvard Oxford and MSDL are very different.
",,,return inmemori label load csv file the code load label harvard oxford msdl differ
issue_comment,930,nilearn,nilearn,banilo,2016-01-17 23:46:23,"+1 for unifying label meta-data!
",,,1 unifi label metadata
issue_comment,930,nilearn,nilearn,banilo,2016-01-12 22:02:07,"Perhaps in form of an additional option in `NiftiLabelsMasker` and `NiftiMapsMasker` ?
",,,perhap form addit option
